Размещение выполняется по;Реестровый номер закупки (заказа);Способ размещения закупки (заказа)\определения поставщика;Наименование заказа\закупки;Номер лота;Наименование лота;Начальная (максимальная) цена контракта (лота)\договора;Код валюты;Классификация по ОКДП;Классификация по ОКПД;Классификация по ОКПД2;Организация, размещающая заказ;Дата размещения;Дата последнего события;Этап закупки (размещения заказа);Особенности размещения заказа\ Преимущества (44);Дата начала подачи заявок;Дата окончания подачи заявок
№ 44-ФЗ;№0151300046816000005;Электронный аукцион;Поставка угля каменного  для нужд общеобразовательных и образовательных учреждений Краснозерского района;;;5469400.00;RUB;;;46.71.11.000: Услуги по оптовой торговле твердым топливом;АДМИНИСТРАЦИЯ КРАСНОЗЕРСКОГО РАЙОНА НОВОСИБИРСКОЙ ОБЛАСТИ;03.02.2016;03.02.2016;Подача заявок;;03.02.2016;19.02.2016
№ 223-ФЗ;№31603277425;Закупка у единственного поставщика (исполнителя, подрядчика);На вывоз ЖБО с территории п. Арамиль (Мельзавод) от объекта «выгребная яма», расположенного по адресу: п.Арамиль, ул.Кооперативная.  ;1;"Вывоз ЖБО с территории п.Арамиль (Мельзавод) от объекта ""выгребная яма"" до ОС п.Светлый";499990.00;RUB;;;;"ОТКРЫТОЕ АКЦИОНЕРНОЕ ОБЩЕСТВО ""ПРЕДПРИЯТИЕ ВОДОПРОВОДНО-КАНАЛИЗАЦИОННОГО ХОЗЯЙСТВА СВЕРДЛОВСКОЙ ОБЛАСТИ""";03.02.2016;03.02.2016;Работа комиссии;;;
№ 44-ФЗ;№0251100003816000031;Электронный аукцион;Поставка сигнализаторов звука световибрационных для обеспечения ими инвалидов;;;538327.80;RUB;;;27.90.20.120: Приборы световой и звуковой сигнализации электрические;ГОСУДАРСТВЕННОЕ УЧРЕЖДЕНИЕ - НОВОСИБИРСКОЕ РЕГИОНАЛЬНОЕ ОТДЕЛЕНИЕ ФОНДА СОЦИАЛЬНОГО СТРАХОВАНИЯ РОССИЙСКОЙ ФЕДЕРАЦИИ;03.02.2016;03.02.2016;Подача заявок;Участникам, заявки или окончательные предложения которых содержат предложения о поставке товаров в соответствии с приказом Минэкономразвития России № 155 от 25.03.2014 - 15%;03.02.2016;12.02.2016
№ 44-ФЗ;№0151300042416000007;Запрос котировок;Поставка частей осветительного оборудования;;;39680.00;RUB;;;27.40.15.110: Лампы газоразрядные27.40.15.114: Лампы люминесцентные27.40.42.000: Части светильников и осветительных устройств;АДМИНИСТРАЦИЯ МАСЛЯНИНСКОГО РАЙОНА НОВОСИБИРСКОЙ ОБЛАСТИ;03.02.2016;03.02.2016;Подача заявок;Субъектам малого предпринимательства и социально ориентированным некоммерческим организациям (в соответствии со Статьей 30 Федерального закона № 44-ФЗ);04.02.2016;10.02.2016
№ 44-ФЗ;№0387200005216000002;Электронный аукцион;Оказание услуг по замене ламп накаливания на светодиодные светильники;;;674833.33;RUB;;;43.21.10.130: Работы по монтажу сетей электроосвещения и электроснабжения и электроарматуры для систем аварийного электроснабжения;"бюджетное учреждение Ханты-Мансийского автономного округа - Югры ""Комплексный центр социального обслуживания населения ""Сфера""";03.02.2016;03.02.2016;Подача заявок;;03.02.2016;11.02.2016
№ 223-ФЗ;№31603276743;СБ-АСТ: Открытый запрос котировок в электронной форме;Поставка светодиодных светильников.;1;Поставка светодиодных светильников.;138000.00;RUB;;;;"Закрытое акционерное общество ""Сбербанк-Автоматизированная система торгов""";03.02.2016;03.02.2016;Подача заявок;;03.02.2016;
№ 44-ФЗ;№0352300131116000007;Электронный аукцион;Приобретение энергосберегающих светильников;;;999320.00;RUB;;;27.40.39.110: Светильники прочие, не включенные в другие группировки;"МУНИЦИПАЛЬНОЕ КАЗЕННОЕ УЧРЕЖДЕНИЕ ""ГОРОДСКОЕ ХОЗЯЙСТВО"" КАЛАЧИНСКОГО ГОРОДСКОГО ПОСЕЛЕНИЯ КАЛАЧИНСКОГО РАЙОНА ОМСКОЙ ОБЛАСТИ";03.02.2016;03.02.2016;Подача заявок;;03.02.2016;11.02.2016
№ 223-ФЗ;№31603277858;Запрос ценовых котировок;Светильники марки АКТАКОМ (607316);1;Светильники марки АКТАКОМ;385200.00;RUB;;;;"ОТКРЫТОЕ АКЦИОНЕРНОЕ ОБЩЕСТВО ""РЯЗАНСКОЕ КОНСТРУКТОРСКОЕ БЮРО ""ГЛОБУС""";03.02.2016;03.02.2016;Подача заявок;;03.02.2016;
№ 223-ФЗ;№31603277775;Запрос котировок в электронной форме;поставка бумаги офисной;1;поставка бумаги офисной;477427.50;RUB;;;;"Государственное унитарное предприятие города Москвы ""Моссвет""";03.02.2016;03.02.2016;Подача заявок;;03.02.2016;
№ 44-ФЗ;№0312100011416000008;Электронный аукцион;Сок яблочный восстановленный осветленный без мякоти. ;;;320000.00;RUB;;;10.32.16.120: Сок яблочный восстановленный;Управление Федеральной службы безопасности Российской Федерации по Республике Тыва;03.02.2016;03.02.2016;Подача заявок;"Субъектам малого предпринимательства и социально ориентированным некоммерческим организациям (в соответствии со Статьей 30 Федерального закона № 44-ФЗ); Организациям инвалидов (в соответствии со Статьей 29 Федерального закона № 44-ФЗ) - 15%";03.02.2016;11.02.2016
№ 223-ФЗ;№31603277576;Запрос предложений;Поставка ЗИП к AQUАMAR.;1;ЗИП к AQUАMAR в количестве 84 шт. Механическое уплотнение AQ-ВО2-047 – 20 шт., Распределительный коллектор и эжектор в сборе – 2 шт., Трансформатор МОNОFASIKO AQ-00-101 – 4 шт., Блок дозирования AQ - 25- 3020 – 10 шт., Красный светодиод ZBV - М 4 – 10 шт., Зеленый светодиод ZBV - М 4 – 10 шт., Электромагниты AQ - 50А-036 – 20 шт., Датчик солености AQ - 00 – 003 – 4 шт., Блок SALINOMENER AQ – 4 шт.;2300000.00;RUB;;;;"Филиал ""35 судоремонтный завод"" Акционерного общества ""Центр судоремонта ""Звездочка""";03.02.2016;03.02.2016;Подача заявок;;03.02.2016;
№ 44-ФЗ;№0362100014416000005;Электронный аукцион;Выполнение работ по замене светильников на светодиодные в коридорах 1, 2, 3, 4, 5-го этажей в рамках капитального ремонта по ул. Колмогорова, 23;;;337457.52;RUB;;;43.21.10.180: Работы электромонтажные по монтажу прочего электрического оборудования, включая электрические солнечные коллекторы и плинтусные обогреватели, в зданиях и сооружениях;"ФЕДЕРАЛЬНОЕ ГОСУДАРСТВЕННОЕ БЮДЖЕТНОЕ ОБРАЗОВАТЕЛЬНОЕ УЧРЕЖДЕНИЕ ВЫСШЕГО ОБРАЗОВАНИЯ ""УРАЛЬСКИЙ ГОСУДАРСТВЕННЫЙ ЮРИДИЧЕСКИЙ УНИВЕРСИТЕТ""";03.02.2016;03.02.2016;Подача заявок;Субъектам малого предпринимательства и социально ориентированным некоммерческим организациям (в соответствии со Статьей 30 Федерального закона № 44-ФЗ);03.02.2016;12.02.2016
№ 223-ФЗ;№31603277491;Запрос предложений;Поставка программного обеспечения «1С Битрикс24» (Коробочная версия, тариф «Корпоративный») с оказанием услуг.;1;Поставка программного обеспечения «1С Битрикс24» (Коробочная версия, тариф «Корпоративный») с оказанием услуг;284500.00;RUB;;;;"ОБЩЕСТВО С ОГРАНИЧЕННОЙ ОТВЕТСТВЕННОСТЬЮ ""ИНЖИНИРИНГОВЫЙ ЦЕНТР ЭНЕРГОСБЕРЕГАЮЩЕЙ СВЕТОТЕХНИКИ""";03.02.2016;03.02.2016;Подача заявок;;03.02.2016;
№ 223-ФЗ;№31603276085;Открытый конкурс;Поставка светотехнической продукции;1;Лот№1: Лампы. ;1600000.00;RUB;;;;"МУНИЦИПАЛЬНОЕ УНИТАРНОЕ ПРЕДПРИЯТИЕ Г. НОВОСИБИРСКА  "" ГОРВОДОКАНАЛ """;03.02.2016;03.02.2016;Подача заявок;;03.02.2016;
№ 223-ФЗ;№31603276085;Открытый конкурс;Поставка светотехнической продукции;2;Лот№2: Светильники ;895000.00;RUB;;;;"МУНИЦИПАЛЬНОЕ УНИТАРНОЕ ПРЕДПРИЯТИЕ Г. НОВОСИБИРСКА  "" ГОРВОДОКАНАЛ """;03.02.2016;03.02.2016;Подача заявок;;03.02.2016;
№ 223-ФЗ;№31603276085;Открытый конкурс;Поставка светотехнической продукции;3;Лот№3: Части светильников и осветительных устройств ;245000.00;RUB;;;;"МУНИЦИПАЛЬНОЕ УНИТАРНОЕ ПРЕДПРИЯТИЕ Г. НОВОСИБИРСКА  "" ГОРВОДОКАНАЛ """;03.02.2016;03.02.2016;Подача заявок;;03.02.2016;
№ 223-ФЗ;№31603276085;Открытый конкурс;Поставка светотехнической продукции;4;Лот№4: Фонари переносные ;230000.00;RUB;;;;"МУНИЦИПАЛЬНОЕ УНИТАРНОЕ ПРЕДПРИЯТИЕ Г. НОВОСИБИРСКА  "" ГОРВОДОКАНАЛ """;03.02.2016;03.02.2016;Подача заявок;;03.02.2016;
№ 223-ФЗ;№31603276085;Открытый конкурс;Поставка светотехнической продукции;5;Лот№5: Элементы питания ;340000.00;RUB;;;;"МУНИЦИПАЛЬНОЕ УНИТАРНОЕ ПРЕДПРИЯТИЕ Г. НОВОСИБИРСКА  "" ГОРВОДОКАНАЛ """;03.02.2016;03.02.2016;Подача заявок;;03.02.2016;
№ 223-ФЗ;№31603276032;Открытый запрос цен;"170/ОЗЦ-ТГ-БФ Поставка светильников для нужд АО ""Томская генерация"" в 2016г.";1;Светильники для АО 'Томская генерация';334894.19;RUB;;;;"АКЦИОНЕРНОЕ ОБЩЕСТВО ""ТОМСКАЯ ГЕНЕРАЦИЯ""";03.02.2016;03.02.2016;Подача заявок;;03.02.2016;
№ 223-ФЗ;№31603276358;Запрос предложений;Поставка светильника люминесцентного.;1;Поставка светильника люминисцентного;419889.97;RUB;;;;"Екатеринбургское муниципальное унитарное предприятие ""Екатеринбургский метрополитен""";03.02.2016;03.02.2016;Подача заявок;;03.02.2016;
№ 44-ФЗ;№0362100014416000004;Электронный аукцион;Выполнение работ по замене светильников на светодиодные в коридорах 1, 3, 4-го этажей в рамках капитального ремонта по ул. Комсомольская, 21;;;392594.26;RUB;;;43.21.10.180: Работы электромонтажные по монтажу прочего электрического оборудования, включая электрические солнечные коллекторы и плинтусные обогреватели, в зданиях и сооружениях;"ФЕДЕРАЛЬНОЕ ГОСУДАРСТВЕННОЕ БЮДЖЕТНОЕ ОБРАЗОВАТЕЛЬНОЕ УЧРЕЖДЕНИЕ ВЫСШЕГО ОБРАЗОВАНИЯ ""УРАЛЬСКИЙ ГОСУДАРСТВЕННЫЙ ЮРИДИЧЕСКИЙ УНИВЕРСИТЕТ""";03.02.2016;03.02.2016;Подача заявок;Субъектам малого предпринимательства и социально ориентированным некоммерческим организациям (в соответствии со Статьей 30 Федерального закона № 44-ФЗ);03.02.2016;12.02.2016
№ 223-ФЗ;№31603277248;Открытый запрос предложений в электронной форме;Право заключения договора на «№8913-117-РОС-16 Выполнение строительно-монтажных работ на объектах энергоблока №4 Ростовской АЭС. Открытое распределительное устройство 500 кВ. Строительная часть: Монтаж автоматических установок пожаротушения в ячейках 13,16. Объединенная насосная станция системы охлаждения основного оборудования. Строительная часть: Дренажный трубопровод системы пожаротушения. Комплекс инженерно-технических мероприятий ГО и ЧС (Убежище на 600 укрываемых и светомаскировка). Строительная часть: Внутренние сети водопровода и канализации.  Технологическая часть: Внешнее топливное хозяйство ДЭС (лот №1046)»;1;Право заключения договора на «№8913-117-РОС-16 Выполнение строительно-монтажных работ на объектах энергоблока №4 Ростовской АЭС. Открытое распределительное устройство 500 кВ. Строительная часть: Монтаж автоматических установок пожаротушения в ячейках 13,16. Объединенная насосная станция системы охлаждения основного оборудования. Строительная часть: Дренажный трубопровод системы пожаротушения. Комплекс инженерно-технических мероприятий ГО и ЧС (Убежище на 600 укрываемых и светомаскировка). Строительная часть: Внутренние сети водопровода и канализации.  Технологическая часть: Внешнее топливное хозяйство ДЭС (лот №1046)»;5495489.79;RUB;;;;"АКЦИОНЕРНОЕ ОБЩЕСТВО НИЖЕГОРОДСКАЯ ИНЖИНИРИНГОВАЯ КОМПАНИЯ ""АТОМЭНЕРГОПРОЕКТ""";03.02.2016;03.02.2016;Подача заявок;;03.02.2016;
№ 223-ФЗ;№31603274615;Запрос коммерческих предложений;поставка светодиодных панелей в марте 2016 г. (далее – товар): наименование, количество, ассортимент которого, указывается в соответствии с требованиями, изложенными в приложении №1 к настоящему извещению. ;1;поставка светодиодных панелей;850000.00;RUB;;;;"Открытое акционерное общество ""Акционерная компания ""Железные дороги Якутии""";03.02.2016;03.02.2016;Подача заявок;;03.02.2016;
№ 223-ФЗ;№31603276669;СБ-АСТ: Открытый аукцион в электронной форме;Поставка ламп энергосберегающих и светодиодных для нужд ГАУСОН РО «Ростовский №2 ДИПИ».;1;Поставка ламп энергосберегающих и светодиодных для нужд ГАУСОН РО «Ростовский №2 ДИПИ».;82885.00;RUB;;;;"Закрытое акционерное общество ""Сбербанк-Автоматизированная система торгов""";03.02.2016;03.02.2016;Подача заявок;;03.02.2016;
№ 223-ФЗ;№31603276657;Запрос котировок;Поставка  светильников (светодиодных) № ЗК  09/223/16   ;1;Светильники (ВПО);26000.00;RUB;;;;"Калужский филиал федерального государственного бюджетного образовательного учреждение высшего профессионального образования ""Московский государственный университет путей сообщения""";03.02.2016;03.02.2016;Подача заявок;;03.02.2016;
№ 223-ФЗ;№31603276260;Запрос предложений;"Оказание услуг по сбору, транспортировке с последующей утилизацией строительных и ТБО от мусоросборника ФКП ""НИЦ РКП"" в г. Пересвет.";1;"Оказание услуг по сбору, транспортировке с последующей утилизацией строительных и ТБО от мусоросборника ФКП ""НИЦ РКП"" в г. Пересвет";660000.00;RUB;;;;"федеральное казенное предприятие ""Научно-испытательный центр ракетно-космической промышленности""";03.02.2016;03.02.2016;Подача заявок;;03.02.2016;
№ 223-ФЗ;№31603274944;Закупка у единственного поставщика (исполнителя, подрядчика);Оказание услуг по поставке тепловой энергии;1;Оказание услуг по поставке тепловой энергии;1384958.81;RUB;;;;"ОБЛАСТНОЕ ГОСУДАРСТВЕННОЕ АВТОНОМНОЕ УЧРЕЖДЕНИЕ ЗДРАВООХРАНЕНИЯ ""СВЕТЛЕНСКАЯ РАЙОННАЯ БОЛЬНИЦА""";03.02.2016;03.02.2016;Работа комиссии;;;
№ 44-ФЗ;№0358300382316000019;Электронный аукцион;"Поставка масла подсолнечного рафинированного для нужд МБУЗ ""Детский санаторий ""Светлячок"" города Ростова-на-Дону в 2016 году";;;49088.21;RUB;;;10.41.54.000: Масло подсолнечное и его фракции рафинированные, но не подвергнутые химической модификации;"Муниципальное бюджетное учреждение здравоохранения ""Детский санаторий ""Светлячок""";03.02.2016;03.02.2016;Подача заявок;;03.02.2016;12.02.2016
№ 44-ФЗ;№0348100019216000009;Электронный аукцион;Светлые нефтепродукты.;;;214500.00;RUB;;;46.71.12.000: Услуги по оптовой торговле моторным топливом, включая авиационный бензин;"ФЕДЕРАЛЬНОЕ ГОСУДАРСТВЕННОЕ БЮДЖЕТНОЕ ОБРАЗОВАТЕЛЬНОЕ УЧРЕЖДЕНИЕ ВЫСШЕГО ПРОФЕССИОНАЛЬНОГО ОБРАЗОВАНИЯ ""МОСКОВСКИЙ ГОСУДАРСТВЕННЫЙ УНИВЕРСИТЕТ ЛЕСА""";03.02.2016;03.02.2016;Подача заявок;;03.02.2016;10.02.2016
№ 44-ФЗ;№0187300014716000009;Электронный аукцион;Оказание услуг по проведению электрических измерений сопротивления изоляции силовой и осветительной сети, контуров заземления измерения и испытания электрооборудования  на объектах социальной сферы Сургутского района с составлением технических отчетов.;;;2674145.50;RUB;;;71.20.13.110: Услуги в области испытаний и анализа механических и электрических характеристик машин, двигателей, автомобилей, станков, приборов, аппаратуры связи и прочего комплектного оборудования, содержащего механические и электрические компоненты;АДМИНИСТРАЦИЯ СУРГУТСКОГО РАЙОНА;03.02.2016;03.02.2016;Подача заявок;Субъектам малого предпринимательства и социально ориентированным некоммерческим организациям (в соответствии со Статьей 30 Федерального закона № 44-ФЗ);03.02.2016;11.02.2016
№ 44-ФЗ;№0348100019216000008;Электронный аукцион;Светлые нефтепродукты.;;;1372500.00;RUB;;;46.71.12.000: Услуги по оптовой торговле моторным топливом, включая авиационный бензин;"ФЕДЕРАЛЬНОЕ ГОСУДАРСТВЕННОЕ БЮДЖЕТНОЕ ОБРАЗОВАТЕЛЬНОЕ УЧРЕЖДЕНИЕ ВЫСШЕГО ПРОФЕССИОНАЛЬНОГО ОБРАЗОВАНИЯ ""МОСКОВСКИЙ ГОСУДАРСТВЕННЫЙ УНИВЕРСИТЕТ ЛЕСА""";03.02.2016;03.02.2016;Подача заявок;;03.02.2016;10.02.2016
№ 223-ФЗ;№31603275881;Закупка у единственного поставщика (исполнителя, подрядчика);"Выполнение работ по световому оформлению мероприятия ""Зимний вечер света в ""Царском Селе"".";1;"Проведение ежегодного праздника ""Зимний фестиваль огней""";317000.00;RUB;;;;"Федеральное государственное бюджетное учреждение культуры ""Государственный художественно-архитектурный дворцово-парковый музей-заповедник ""Царское Село""";03.02.2016;03.02.2016;Работа комиссии;;;
№ 44-ФЗ;№0819300027016000012;Электронный аукцион;Обслуживание светофорных объектов в количестве 13 шт.;;;630010.00;RUB;;;43.21.10.220: Работы по монтажу систем освещения и сигнализации автомобильных дорог, аэропортов и портов;"МУНИЦИПАЛЬНОЕ КАЗЕННОЕ УЧРЕЖДЕНИЕ ""СЛУЖБА МУНИЦИПАЛЬНЫХ КОНТРАКТОВ"" Г.НАЗАРОВО КРАСНОЯРСКОГО КРАЯ";03.02.2016;03.02.2016;Подача заявок;;03.02.2016;11.02.2016
